{
  "schema_version": "1.0.0",
  "plan_id": "RECIPE-PLAN-CBP-VIDEO-00-V1",
  "generator_version": "creative-recipe-compose-v1",
  "blueprint": {
    "id": "CBP-VIDEO-00-V1",
    "video_id": "VIDEO-00",
    "path": "Framework-Edicion-Social/templates/creative-blueprint.json",
    "sha256": "c040d6278e0ddb5d3397a53ae2b98c2c803178e79f28f7c52ccaedbaded66b8c",
    "duration_target_s": 30
  },
  "inputs": {
    "catalog": {
      "path": "Framework-Edicion-Social/creative-recipes/catalog.json",
      "sha256": "79a0dcc5f0fad82c302ff134a6902c30621ca1ed0f8c94dc174b561a9b5981eb"
    },
    "series_contract": {
      "path": null,
      "sha256": null
    },
    "series_memory": {
      "path": null,
      "sha256": null
    },
    "asset_index": {
      "path": null,
      "sha256": null
    }
  },
  "recommendation_policy": {
    "max_proposals": 3,
    "minimum_fit_score": 0.58,
    "minimum_confidence_score": 0.55,
    "minimum_module_differences_between_options": 2,
    "single_global_winner": false,
    "automatic_promotion": false,
    "human_choice_required": true,
    "preserve_multiple_families": true,
    "ranking_meaning": "contextual_review_order_not_quality_or_universal_winner"
  },
  "status": "proposed",
  "abstention_reasons": [],
  "proposal_count": 3,
  "proposals": [
    {
      "option_id": "OPTION-A",
      "recipe_id": "RECIPE-CBP-VIDEO-00-V1-2051B4BB1DFB",
      "label": "Afirmación, prueba y acción · Editorial en espacio negativo",
      "module_ids": {
        "hook": "HOOK-CONTRARIAN-OUTCOME",
        "structure": "STRUCT-CLAIM-PROOF-ACTION",
        "visual_system": "VIS-NEGATIVE-SPACE-EDITORIAL",
        "motion": "MOTION-SEMANTIC-PUNCHIN",
        "sound": "SOUND-SOFT-PUNCTUATION",
        "cta": "CTA-REFLECTIVE-QUESTION"
      },
      "primary_family_id": "FAMILY-CLEAN-AUTHORITY",
      "hybrid": true,
      "contributing_family_ids": [
        "FAMILY-CLEAN-AUTHORITY",
        "FAMILY-EDITORIAL-LOOP"
      ],
      "fit_score": 0.983558,
      "confidence": {
        "score": 0.955319,
        "level": "high",
        "basis": [
          "context_categories:5/5",
          "traceability:0.890",
          "asset_coverage:unknown"
        ]
      },
      "score_breakdown": [
        {
          "module_id": "HOOK-CONTRARIAN-OUTCOME",
          "kind": "hook",
          "fit_score": 0.984167,
          "positive_matches": [
            "context:high_contrast_editorial",
            "context:process_explanation",
            "context:technology",
            "duration:30s",
            "energy_fit:0.842",
            "hook_pattern:contrarian",
            "narrative_roles:hook",
            "narrative_roles:value",
            "platform_fit:full_length_reel",
            "source_geometry:talking_head"
          ],
          "negative_matches": []
        },
        {
          "module_id": "STRUCT-CLAIM-PROOF-ACTION",
          "kind": "structure",
          "fit_score": 0.998016,
          "positive_matches": [
            "context:authority",
            "context:high_contrast_editorial",
            "context:technology",
            "duration:30s",
            "energy_fit:0.983",
            "narrative_roles:cta",
            "narrative_roles:hook",
            "narrative_roles:value",
            "platform_fit:full_length_reel",
            "source_geometry:talking_head"
          ],
          "negative_matches": []
        },
        {
          "module_id": "VIS-NEGATIVE-SPACE-EDITORIAL",
          "kind": "visual_system",
          "fit_score": 0.992063,
          "positive_matches": [
            "context:high_contrast_editorial",
            "context:talking_head",
            "context:technology",
            "duration:30s",
            "energy_fit:0.933",
            "narrative_roles:cta",
            "narrative_roles:hook",
            "narrative_roles:value",
            "platform_fit:full_length_reel",
            "source_geometry:talking_head"
          ],
          "negative_matches": []
        },
        {
          "module_id": "MOTION-SEMANTIC-PUNCHIN",
          "kind": "motion",
          "fit_score": 0.996032,
          "positive_matches": [
            "context:high_contrast_editorial",
            "context:talking_head",
            "context:technology",
            "duration:30s",
            "energy_fit:0.967",
            "narrative_roles:cta",
            "narrative_roles:hook",
            "platform_fit:full_length_reel",
            "source_geometry:talking_head"
          ],
          "negative_matches": []
        },
        {
          "module_id": "SOUND-SOFT-PUNCTUATION",
          "kind": "sound",
          "fit_score": 0.992063,
          "positive_matches": [
            "context:high_contrast_editorial",
            "context:talking_head",
            "context:technology",
            "duration:30s",
            "energy_fit:0.933",
            "narrative_roles:cta",
            "narrative_roles:hook",
            "platform_fit:full_length_reel",
            "source_geometry:talking_head"
          ],
          "negative_matches": []
        },
        {
          "module_id": "CTA-REFLECTIVE-QUESTION",
          "kind": "cta",
          "fit_score": 0.915833,
          "positive_matches": [
            "context:education",
            "context:process_explanation",
            "duration:30s",
            "energy_fit:0.858",
            "hook_pattern:contrarian",
            "narrative_roles:cta",
            "platform_fit:full_length_reel",
            "source_geometry:talking_head"
          ],
          "negative_matches": []
        }
      ],
      "compatibility": {
        "passed": true,
        "blocking_conflicts": [],
        "warnings": [
          "asset_index_not_provided; resource coverage remains unverified",
          "series_memory_not_provided; fatigue cannot be evaluated"
        ]
      },
      "fatigue": {
        "window": 3,
        "signal": "no_history",
        "penalty": 0.0,
        "matched_prior_entries": [],
        "is_quality_score": false
      },
      "asset_fit": {
        "index_provided": false,
        "coverage_status": "unknown",
        "required_types": [
          "sfx"
        ],
        "available_types": [],
        "missing_types": [],
        "preferred_types_available": []
      },
      "effort": {
        "points": 13,
        "level": "low",
        "minutes_min": 35,
        "minutes_max": 68,
        "asset_generation_count": 0
      },
      "creative_direction": {
        "hook": {
          "module_id": "HOOK-CONTRARIAN-OUTCOME",
          "label": "Giro contrarian con beneficio",
          "directives": [
            "Abrir con la negación o contraste antes de 1.2 segundos.",
            "Hacer visible la consecuencia útil en el mismo beat o en el siguiente.",
            "Usar un solo acento visual dominante y dejar respirar la última palabra."
          ]
        },
        "structure": {
          "module_id": "STRUCT-CLAIM-PROOF-ACTION",
          "label": "Afirmación, prueba y acción",
          "directives": [
            "Entregar la tesis antes de enumerar evidencia.",
            "Usar solo la evidencia necesaria para sostener la afirmación.",
            "Cerrar con una acción que el espectador pueda ejecutar o responder."
          ]
        },
        "visual_system": {
          "module_id": "VIS-NEGATIVE-SPACE-EDITORIAL",
          "label": "Editorial en espacio negativo",
          "directives": [
            "Anclar el contenido principal a un borde y evitar tarjetas flotando al centro.",
            "Usar dos puntos focales como máximo cuando el rostro permanece visible.",
            "Alternar imagen, icono y tipografía según el significado, no por cuota."
          ]
        },
        "motion": {
          "module_id": "MOTION-SEMANTIC-PUNCHIN",
          "label": "Punch-in semántico",
          "directives": [
            "Marcar de dos a cuatro palabras o cambios de idea por minuto como máximo inicial.",
            "Alternar punch-in, punch-out y quietud según la jerarquía.",
            "Animar el contenedor interior para conservar el recorte y la zona segura."
          ]
        },
        "sound": {
          "module_id": "SOUND-SOFT-PUNCTUATION",
          "label": "Puntuación suave",
          "directives": [
            "Usar un acento de hook, uno o dos detalles y una resolución como presupuesto inicial.",
            "Separar los eventos para que no formen una secuencia constante.",
            "Descartar cualquier sonido áspero o más llamativo que la palabra que acompaña."
          ]
        },
        "cta": {
          "module_id": "CTA-REFLECTIVE-QUESTION",
          "label": "Pregunta aplicable al caso propio",
          "directives": [
            "Formular una sola pregunta, concreta y sin dos verbos de acción.",
            "Reducir movimiento después de su entrada para permitir lectura.",
            "Cerrar con contacto visual o plano estable cuando esté disponible."
          ]
        },
        "face_safe_notes": [
          "Cada SFX tiene intención semántica y su nivel se evalúa bajo la voz.",
          "Cada zoom tiene disparador semántico y escala limitada.",
          "Cualquier cruce permitido dura como máximo 0.3s y requiere revisión manual.",
          "Cualquier cruce sobre el rostro debe ser una transición breve y revisada.",
          "Detectar espacio negativo por beat; no asumir que una zona sirve durante toda la toma.",
          "El CTA deriva de la misma tesis y no abre un tema nuevo.",
          "El silencio es una decisión válida entre acentos.",
          "El énfasis visual usa espacio negativo y no cubre ojos ni boca.",
          "La pregunta se deriva del valor entregado y deja un beat de respuesta.",
          "La primera frase expresa valor o riesgo para el espectador, no una lista de funciones.",
          "La prueba se distingue visualmente de la afirmación.",